{
  "artifact_set_id": "mistralai-mistral-small-3-2-24b-instruct-2506--safetensors--consolidated.safetensors",
  "auxiliary_bytes": null,
  "companion_components": [
    "config",
    "docs",
    "index",
    "metadata",
    "tokenizer"
  ],
  "files": [
    {
      "extension": ".safetensors",
      "filename": "consolidated.safetensors",
      "path": "consolidated.safetensors",
      "source_reported_size_bytes": 48022792280
    }
  ],
  "format": "safetensors",
  "kind": "single",
  "model_id": "mistralai-mistral-small-3-2-24b-instruct-2506",
  "primary_weight_bytes": 48022792280,
  "revision": "95a6d26c4bfb886c58daf9d3f7332c857cb27b43",
  "schema_version": "0.2.0",
  "shard_count": 1,
  "shard_total": null,
  "shards_complete": null,
  "total_source_reported_bytes": 48022792280,
  "variant": null,
  "verification_status": "source_reported"
}
