{
  "artifact_set_id": "quantfactory-qwen3-8b-gguf--gguf--qwen3-8b-gguf--q6_k",
  "auxiliary_bytes": null,
  "companion_components": [
    "docs",
    "metadata"
  ],
  "files": [
    {
      "extension": ".gguf",
      "filename": "Qwen3-8B.Q6_K.gguf",
      "path": "Qwen3-8B.Q6_K.gguf",
      "source_reported_size_bytes": 6725899456
    }
  ],
  "format": "GGUF",
  "kind": "single",
  "model_id": "quantfactory-qwen3-8b-gguf",
  "primary_weight_bytes": 6725899456,
  "revision": "1a85ad16e1e80725404ad707448c10dd414ed045",
  "schema_version": "0.2.0",
  "shard_count": 1,
  "shard_total": null,
  "shards_complete": null,
  "total_source_reported_bytes": 6725899456,
  "variant": "Q6_K",
  "verification_status": "source_reported"
}
