{
  "artifact_set_id": "unsloth-qwen3-8b-gguf--gguf--qwen3-8b-gguf--q8_0",
  "auxiliary_bytes": null,
  "companion_components": [
    "config",
    "docs",
    "imatrix",
    "metadata",
    "other"
  ],
  "files": [
    {
      "extension": ".gguf",
      "filename": "Qwen3-8B-Q8_0.gguf",
      "path": "Qwen3-8B-Q8_0.gguf",
      "source_reported_size_bytes": 8709519168
    }
  ],
  "format": "GGUF",
  "kind": "single",
  "model_id": "unsloth-qwen3-8b-gguf",
  "primary_weight_bytes": 8709519168,
  "revision": "a6adef130ffb23ddaf1a62fec9dced968c9bc482",
  "schema_version": "0.2.0",
  "shard_count": 1,
  "shard_total": null,
  "shards_complete": null,
  "total_source_reported_bytes": 8709519168,
  "variant": "Q8_0",
  "verification_status": "source_reported"
}
