{
  "artifact_set_id": "ifm-k2-horizon-7b-gguf--gguf--k2-horizon-7b-gguf--q4_k_m",
  "auxiliary_bytes": null,
  "companion_components": [
    "docs",
    "metadata"
  ],
  "files": [
    {
      "extension": ".gguf",
      "filename": "K2-Horizon-7B-Q4_K_M.gguf",
      "path": "K2-Horizon-7B-Q4_K_M.gguf",
      "source_reported_size_bytes": 5592217984
    }
  ],
  "format": "GGUF",
  "kind": "single",
  "model_id": "ifm-k2-horizon-7b-gguf",
  "primary_weight_bytes": 5592217984,
  "revision": "9fb01f7b397994455262f4b8256e4e00e4949ea9",
  "schema_version": "0.2.0",
  "shard_count": 1,
  "shard_total": null,
  "shards_complete": null,
  "total_source_reported_bytes": 5592217984,
  "variant": "Q4_K_M",
  "verification_status": "source_reported"
}
