{
  "artifact_set_id": "bartowski-openai-gpt-oss-20b-gguf--gguf--openai_gpt-oss-20b-gguf--q2_k_l",
  "auxiliary_bytes": null,
  "companion_components": [
    "docs",
    "imatrix",
    "metadata"
  ],
  "files": [
    {
      "extension": ".gguf",
      "filename": "openai_gpt-oss-20b-Q2_K_L.gguf",
      "path": "openai_gpt-oss-20b-Q2_K_L.gguf",
      "source_reported_size_bytes": 11848568896
    }
  ],
  "format": "GGUF",
  "kind": "single",
  "model_id": "bartowski-openai-gpt-oss-20b-gguf",
  "primary_weight_bytes": 11848568896,
  "revision": "e39ba3aa000c47c83dacdc9e1ca2c9dd0808c205",
  "schema_version": "0.2.0",
  "shard_count": 1,
  "shard_total": null,
  "shards_complete": null,
  "total_source_reported_bytes": 11848568896,
  "variant": "Q2_K_L",
  "verification_status": "source_reported"
}
