{
  "artifact_set_id": "unsloth-qwen3-8b-gguf--gguf--qwen3-8b-ud-gguf--q6_k_xl",
  "auxiliary_bytes": null,
  "companion_components": [
    "config",
    "docs",
    "imatrix",
    "metadata",
    "other"
  ],
  "files": [
    {
      "extension": ".gguf",
      "filename": "Qwen3-8B-UD-Q6_K_XL.gguf",
      "path": "Qwen3-8B-UD-Q6_K_XL.gguf",
      "source_reported_size_bytes": 7490549568
    }
  ],
  "format": "GGUF",
  "kind": "single",
  "model_id": "unsloth-qwen3-8b-gguf",
  "primary_weight_bytes": 7490549568,
  "revision": "a6adef130ffb23ddaf1a62fec9dced968c9bc482",
  "schema_version": "0.2.0",
  "shard_count": 1,
  "shard_total": null,
  "shards_complete": null,
  "total_source_reported_bytes": 7490549568,
  "variant": "Q6_K_XL",
  "verification_status": "source_reported"
}
