{
  "artifact_set_id": "bartowski-qwen2-5-7b-instruct-gguf--gguf--qwen2.5-7b-instruct-4_8.gguf--q4_0",
  "auxiliary_bytes": null,
  "companion_components": [
    "docs",
    "imatrix",
    "metadata"
  ],
  "files": [
    {
      "extension": ".gguf",
      "filename": "Qwen2.5-7B-Instruct-Q4_0_4_8.gguf",
      "path": "Qwen2.5-7B-Instruct-Q4_0_4_8.gguf",
      "source_reported_size_bytes": 4431391424
    }
  ],
  "format": "GGUF",
  "kind": "single",
  "model_id": "bartowski-qwen2-5-7b-instruct-gguf",
  "primary_weight_bytes": 4431391424,
  "revision": "8911e8a47f92bac19d6f5c64a2e2095bd2f7d031",
  "schema_version": "0.2.0",
  "shard_count": 1,
  "shard_total": null,
  "shards_complete": null,
  "total_source_reported_bytes": 4431391424,
  "variant": "Q4_0",
  "verification_status": "source_reported"
}
